Timestamp,Content Type,Title,Content,Upvotes Count,Comments Count,Upvote Ratio,Flair,Permalink,Reddit ID
2023-04-07 10:17:53,Text-only,AntiworkPH Community Rules and Guidelines,"Hello members and new comers!

Please see the official community rules and guidelines:

1. NO BULLYING OR HATE SPEECH: This is against the community rules and we are here for healthy discussions and debates. Any bullying or hate speech will be subject for being banned in this subreddit

2. NO UNRELATED TOPICS: This includes office romances, affairs, personal issues, etc. 

3. NO SOLICITATION OR SELF-PROMOTION: We are here to discuss work reform and unfair labor laws. Anything related to solicitation or self-promotion will be subject for being banned as well.

4. WORK ADVISES AND CAREER DISCUSSIONS: we understand that career discussions and advises are mainly posted in r/phcareers but we will open and pin an OFFICIAL thread where you can discuss this in the comment section

5. COMPANY NAME DISCUSSION: It's the choice of the redditor to name-drop companies he/she wishes to discuss. However, please note that DOXXING reddit users or HR personnel are NOT ALLOWED in respect of their privacies

6. 3 WARNING RULES: You will be given 3 WARNINGS before being banned in this subreddit. Exceeding beyond 3 warnings will automatically kick you out of this group

If you have any suggestions or comments, please feel free to comment below.

Thank you!",42,17,0.88,Discussions 💭,https://www.reddit.com//r/AntiworkPH/comments/12e6e06/antiworkph_community_rules_and_guidelines/,12e6e06
2024-04-01 14:47:59,Text-only,"Complete the sentence: Rendering/Retrenched na ako, of course...",tinatamad na ko magtodo effort.,0,7,0.33,Meme 🔥,https://www.reddit.com//r/AntiworkPH/comments/1bswt61/complete_the_sentence_renderingretrenched_na_ako/,1bswt61
2024-02-22 17:15:36,Image,360 a day sahod with qualifications pa,Di ko alam kung troll jobpost lang ito or ano hahaha,46,12,0.96,Meme 🔥,https://www.reddit.com//r/AntiworkPH/comments/1ax26gh/360_a_day_sahod_with_qualifications_pa/,1ax26gh
2024-02-21 21:14:43,Text-only,FINALLY 🥹,"Not sure if this is the right sub, but I just want to share what happened today at work. I finally tendered my resignation!!! I recently posted on this sub about how toxic our management has become, and how I couldn't wait to resign. Today, I finally did 🥹

On Monday, I got an email for my JO with one of the companies I applied to. It took two weeks for them to get back to me and I actually thought di na ako ma-cconsider for the role. I also had 2 interviews that day tapos after ng mga yon, nanghingi akong sign kasi ayoko na talaga sa current job ko. Then I received an email regarding my job offer minutes later. At first, na-overwhelm ako kasi na-realize ko na medyo alanganin pala yung pag-apply ko. Bonus na kasi ng April and since natagalan yung job offer, I thought, why not just wait it out until then. Pero ayun nga nag-email na sila nung Monday. Naisip ko rin na wag muna tanggapin kasi if di okay ang offer, then I'll keep looking pa. Sa sobrang stress ko kasi, simula November 2023, nag-update akong resume ko para by January, makapag-apply na ako. Nagda-dalawang isip pa nga ako last month pero every time na merong di okay na mangyari sa office, nag-aapply ako pag-uwi. Parang every time I come in to that office and start my day, answering calls (CSR ako), lagi akong nabibigyan ng hundred reasons to leave. Everyday kong na-rrealize na hindi talaga siya para sa akin and hindi ko na kayang tumagal pa. Ang baba rin kasi ng sahod so bakit pa ako mag-ssuffer. The universe heard me and ito na yung sign na hiningi ko, yung matagal ko ng hinihintay. Buti na lang talaga na okay na okay yung offer sa akin. Upgrade talaga siya sa current compensation ko. I still have a long way to go, pero ganon naman diba, you really have work your way up to get better things. 

It was bittersweet, if I'm being honest, kasi I'm very close with my teammates and other officemates. Napalapit na rin ako sa kanila and ang sad lang na di ko na sila makikita everyday once I leave. Meron din akong work bestie na kasabay ko nung trainee days ko. We went through a lot together and siya talaga ang pinaka-mamimiss ko. But I have to choose myself and I will always keep choosing myself. Promise ko sa sarili ko this year na i-pprioritize ko na yung needs ko, lalong lalo na if involved ang work. If hindi ko na talaga gusto yung ginagawa ko, or toxic na talaga, I have to do something about it. So I'm really proud of myself for finally resigning because it took a lot of courage. Swerte ko lang din kasi I was able to find a new job kahit na Feb pa lang. Mahirap maghanap ng trabaho lalo na for a career shifter like me. Di rin naman ako privileged enough to resign and saka lang maghahanap ng bago. Hopefully, yung lilipatan ko magiging okay siya. It's a completely different role so I'll have to start from 0 ulit. But I do have a really good feeling about this one. Really looking forward to this new beginning. 

Just really wanted to share this big win for me! Kapagod maging corpo slave no? Gusto ko na lang maging Disney princess for real hahahaha

 If you're looking for a sign to resign, baka ito na yon! Go mo na yan 🤪
",24,13,0.87,Story 🗣️,https://www.reddit.com//r/AntiworkPH/comments/1awbr7d/finally/,1awbr7d
2024-02-21 14:56:01,Text-only,Na worng send sa management!!,"Chumichika ako sa ka work, tapos na wrong send ako pucha. Yung chika ay “pa refer” “di pa ako makaalis kasi kailangan ko yung company”
Note na kaka promote ko lang HAHHAHA

Tangina talaga gusto ko na magpalamon sa lupa. 

Dinelete ko, pero sure ako nabasa nila yon. 

Red flag na ba to sa future  growth and relationship ko sa higher ups?? Hhaahahuhu siyet!

Edit: okay pa rin naman sila sa akin at chinichika pa rin nila ako. Kwentuhan  ganyan. 
",42,31,0.92,Story 🗣️,https://www.reddit.com//r/AntiworkPH/comments/1aw5oqr/na_worng_send_sa_management/,1aw5oqr
2024-02-21 11:00:48,Text-only,10 php per hour.,"Nag OJT na ang bunso kong kapatid para grade 12 requirements nila, leche natanong ko 10 pesos per hour ang bayad sa kanila napamura ako sa chow king anak ng tokwa pamasahe palang at mga ginastos namen pra pang requirements di nya man mararandaman ganito ba ka fk up ang fast food companies sa mga students?",55,68,0.94,Rant 😡,https://www.reddit.com//r/AntiworkPH/comments/1aw1842/10_php_per_hour/,1aw1842
2024-02-21 10:16:37,Text-only,Yung HR namin hindi totoong HR,Kabadtrip yung HR namin ako tinatanong kung nag file ba ako ng leave nung namatayan ako ng kamag anak. Like duhfuck? Wala ka bang record to check? Out HR is not HRing 😂,49,39,0.92,Story 🗣️,https://www.reddit.com//r/AntiworkPH/comments/1aw0a16/yung_hr_namin_hindi_totoong_hr/,1aw0a16
2024-02-21 20:13:42,Text-only,Some Reminders AntiWorkPh Peeps,"This IG video sums it all.
https://www.instagram.com/reel/C3WDCT-MWHn/?igsh=aGp2OHBhcGo1dXNt

Always remember! HR is not your friend.
There are no coworker friends, only friendly co workers.

Do you guys agree with the vid?",7,3,0.82,Discussions 💭,https://www.reddit.com//r/AntiworkPH/comments/1awalpj/some_reminders_antiworkph_peeps/,1awalpj
2024-02-21 20:55:24,Text-only,3 Months hold ang final pay ko,"3mos na akong resigned sa previous company (Govt agency) na pinasukan ko.  Tinatawagan ako ng mga kasamahan ko dati para pumasok at ituro sa kanila ang dati kong trabaho. Maayos akong nagexplain sa kanila na hindi ako makakapunta after working hrs dahil pagod na ako sa byahe at sa maghapong trabaho sa bagong pinapasukan ko. If hindi daw ako makakapunta sa gabi ay kahit 6am na lang daw ng umaga. Hindi ako pumayag dahil sa hassle ng commute at mala-late ako sa new work ko. Humingi rin ako ng pasensya dahil hindi ko agad narereplyan at nasasagot ang mga tawag nila. Ngayon ay gusto nilang i-hold ang final pay ko kung hindi ako pupunta sa dati kong pinapasukan. Cleared at pirmado ang clearance ko at meron akong signed document ng mga turnover tasks at documents na hawak ko. Lahat ng pinapagawa nila kahit resigned na ako ay ginawa ko para lang marelease ang final pay ko. Ngayon lang ako humindi sa gusto nilang ipagawa. May pagasa pa ba akong makuha ang final pay ko? Kung may mga alam kayong batas na pwedeng kong gamiting reference sa sulat, pls share. ",5,2,1.0,Advice Needed 🤔,https://www.reddit.com//r/AntiworkPH/comments/1awbdj2/3_months_hold_ang_final_pay_ko/,1awbdj2
2024-02-21 23:10:54,Text-only,Pwede ba ireklamo pag delayed sahod?,"Hello! Naging contract of service ako sa UP last December 2023. 

Bilang unemployed ako tinanggap ko na kahit 1 buwan lang. Malaki rin yung bayad. Fast forward to now, wala pa rin yung bayad. Tapos na lahat ng deliverables. Ang malala pa hindi man lang kami ma-update kung anong status na. Alam ko mabagal sa govt pero grabe naman may buong January sila para ayusin ang paperworks nung bayad pero ano na? 

Sobrang frustrating kasi inaasahan ko yun habang walang work tapos ganto nangyari. Para akong dinaya. Any advice? 😓

Gusto ko na sila ireklamo. ",2,2,1.0,Advice Needed 🤔,https://www.reddit.com//r/AntiworkPH/comments/1awedag/pwede_ba_ireklamo_pag_delayed_sahod/,1awedag
2024-02-22 02:50:14,Text-only,SSS Sickness Benefit Late Filing Issue,"SSS Sickness Benefit

Hello, question lang po. May issue lng po kasi ako regarding ng late filing sa sss dahil matagal na process ng accounting namin.

Bale po ganito yung timeline ng nangyari:

Dec 23: requested to bed rest dahil high-risk pregnancy. Nasubmit ko on time lahat ng requirements at na-forward ko sa HR at accounting na din. Bali 1 month bed rest yung required ko Dec 23 to Jan 19

Jan 3: dyan pa nila na notify yung sss kahit ilang beses akong nag-follow up sa kanila at nag-remind regarding na within 5 days lang dapat ang notification para hindi ma tag as “late filing”

Jan 19: na reject ng medical evaluation kasi dapat magsubmit ng certified true copy na ultrasound, which is hindi mn lang nag confirm yung hr or accounting na needed yun kahit tinanong ko sila ng paulit-ulit if needed ba. So ayun since na-reject, agad ko namang sinubmit yung kulang na requirements at finorward ko sa kanila. Then sa time na din nito, inextend pa din ang bed rest ko Jan 20 to Feb 19. So sinend ko nalang din yung requirements for second SN filing para isang galawan nalang.

Jan 25: dyan pa nila na notify uli sila sa first SN ko at second SN.

Feb 12: nag notify yung SSS na approve na daw for advance payment yung first SN ko, pero hindi nagbigay ng advance payment yung employer ko. Then yung second SN naman, rejected dahil hindi pa na settle yung first. So agad kong ni-notify yung hr at accounting about it when ma-reimburse yung advance payment pero walang response sa kanilang end kahit ilang follow-up na ang nangyari.

Feb 21: naka receive ako ng email ng SSS na ipa-confirm ko daw yung advance payment na na-receive (30 days count; which is wala naman talaga ni piso) at nakita kong 8 days lng yung babayran for reimbursement sa employer ko instead na 30 days dahil nga daw late nag file. Nag inquire ako nito, then sabi ng accounting na dapat ko i confirm daw para ma-receive yung reimbursement. Pero ang ending yung 8 days lng ang maibibigay dahil nga late.

Nag-reklamo ako na unfair sa part ko na mag acknowledge na naka receive nga daw ako nga advance payment (which is **,*** then yung ibibigay lng pala nila is *,*** if nag approve ako). Hindi mn lang half sa supposedly na matatanggap ko.

Ano po ba ang pwede kong gawin neto? Pwede bang mag reklamo sa sss mismo? Anong mangyayari if hindi ko i-coconfirm. Kase base lng sa email ng accounting, hindi daw i-rerelease yung payment kung di daw ako mag confirm or approve. At ang hirap pa, damay yung second SN ko dahil dito.

Please help advise po.",0,0,0.5,Advice Needed 🤔,https://www.reddit.com//r/AntiworkPH/comments/1awjxys/sss_sickness_benefit_late_filing_issue/,1awjxys
2024-02-21 22:25:08,Text-only,Giving Reviews after leaving a Company? Do it! Really helps for those job seekers,"**INTRO muna:** Kung ganado ka naman magbasa at magsulat, sana huwag ka na rin tamarin sa pagbigay ng reviews or ratings sa mga previous company mo.

So, share ko lang... Alam ko na konti lang talaga gumagawa nito pero sana, dumami na kasi malaking tulong siya talaga. Kung gumagawa kayo ng LinkedIn, Jobstreet, Indeed, Glassdoor, or kung ano-ano or saan pang mga Job Hiring Site, try niyo na rin mag-effort na magbigay ng reviews, especially kung negative or bad reviews pa nga 'yan sa mga previous company niyo.

Ako kasi ginawa ko siya sa lahat ng mga previous company ko. Nilagay ko talaga yung salary ko roon, pros and cons. Napakarami sa cons talaga. Bawal company, sinabi ko talaga na yung cons and bad experiences ko. Sa good kasi, I don't know, kahit maganda yung company konti lang talaga nasabi ko kasi nga, parang yung mga magaganda na 'yon, bare minimum and common at basic naman na dapat sa isang company culture. Pero yung sa cons? Since, iba-iba work experiences ko, iba-iba rin nasabi ko. As in, elaborated. Masyado na kasi gasgas kung ang sasabihin ko lang *toxic management, delayed salary, no healthcard, powertripping colleagues, entitled tenured* halos lahat naman kasi may ganyan talaga. As in, sinabi ko talaga bad experiences ko sa mga department, ganito-ganyan, hindi maasahan yung department na 'to sa ganito kahit trabaho naman nila 'yon, mga ganyang bagay ba.

Nung panahong naghahanap ako ng work, as much as possible, chine-check ko talaga sa kung saan-saan makabasa lang talaga ako ng reviews sa company na binabalak ko apply-an that time.

Ako talaga, bilang ganti ko sa mga previous company ko, halos lahat may bad experiences ako, ang ginawa ko talaga sa halos lahat ng mga pwede ako magbigay ng reviews, nagbigay talaga ako. Kasi alam kong may nagbabasa talaga especially kung higher position. Pero sana kahit hindi higher, maglagay pa rin kayo.

Anonymous naman kasi tayo roon, walang makakaalam na tayo ang nagbigay ng bad feedback. Unless, masyadong obvious like kung paano ka mag-type, mag-english or nabanggit mo yung mga details na masyadong obvious na sarili mo tinutukoy mo. Make it vague pa rin pero alam mo na makaka-impact pa rin sa mga nagbabalak mag-apply.",3,0,0.71,Advice Needed 🤔,https://www.reddit.com//r/AntiworkPH/comments/1awd9y7/giving_reviews_after_leaving_a_company_do_it/,1awd9y7
2024-02-21 16:16:26,Text-only,1 DAY VL DENIED BECAUSE OF BOOTHCAMP FINAL EXAM,I emailed our manager for a 1 day vl for a wedding (isa kasi ako sa abay and it i will disappoint the family if i couldn't make it) obviously it got denied because of the final exam sa boothcamp. They said na It's a lot of effort daw for them to make another exam just to make sure no exam will spoil. I said in reply that I understood the concern but today I was thinking if they could trust me and take the exam hours after/before the wedding. Please send help what should I say or if may other effective excuse kayo in mind. I really want to attend kasi sayang yung budget ko sa dress and all. ,7,8,1.0,Tips 🔔,https://www.reddit.com//r/AntiworkPH/comments/1aw6y9n/1_day_vl_denied_because_of_boothcamp_final_exam/,1aw6y9n
2024-02-21 11:52:05,Text-only,"Toxic workmate na siya lagi ang tama, naninigaw at sumbungera 🤡 ","I just had my last straw yesterday. 

My job is to write articles that'll be published sa website. My articles were always proofread by 3 higher ups before publishing.

 So this coworker na hindi connected sa tasks ko + di naman higher up, we have the same salary grade, ay lagi nangengeelam sa aking articles.

Yesterday, she wants to ""correct"" some of my words sa article. And then i told her na ganito dapat ganyan based sa dating mentor namin. 

The she SHOUTED to my face na, hindi mali dapat ganito ganyan. 

Although alam kong tama ako, i just said ""ok ok"". Since i dont like being shouted at.

I mean, in a professional environment need pa ba manigaw and someone can say it nicely naman.

Im so down rn. Idk how to handle those kind of people na, kasi sumbungera siya malamang sinumbong na naman niya akong mali sa manager namin.

Ano ba psychology sa toxic trait ng mga taong ganito? And paano ko ito ihhandle professionally (kung kaya pa) at kanal way kasi pikon na ko besh.

",11,12,1.0,Advice Needed 🤔,https://www.reddit.com//r/AntiworkPH/comments/1aw2aeg/toxic_workmate_na_siya_lagi_ang_tama_naninigaw_at/,1aw2aeg
2024-02-21 11:00:40,Text-only,10 php per hour.,"Nag OJT na ang bunso kong kapatid para grade 12 requirements nila, leche natanong ko 10 pesos per hour ang bayad sa kanila napamura ako sa chow king anak ng tokwa pamasahe palang at mga ginastos namen pra pang requirements di nya man mararandaman ganito ba ka fk up ang fast food companies sa mga students?",10,19,0.75,Rant 😡,https://www.reddit.com//r/AntiworkPH/comments/1aw1809/10_php_per_hour/,1aw1809
2024-02-21 20:32:34,Text-only,Legal Help needed.," 

Hi. Need suggestion/s and/or advice po regarding my past job. 

So I worked as a sales in this company pero nagresign na ako last year. Ang nature of business ng company ay fabrication. What happened is after ilang months na resigned na ko, kinocontact ako ng past clients ko na may problem sa projects in which I contacted the company I used to work for but they are not offering any solution sa clients regarding sa projects na yun. Ang mali ko dito is ako yung nakapirma sa documents, kaya ako yung liable, pero yung pera na downpayment ay nakuha ng company. Now they are denying my employment and their connection sa projects na yun even though aware yung clients na nakipag transact sila sa company na yun at hindi lang sa akin. I have proofs and all pero kasi ang ginawa ko nung times na yun, inuna kong tapusin ang projects kesa sa ireklamo sila since napaka passive nila and unfair, para ma clear ang name ko. 

Sa mga lawyers po dito marami din po sana akong tanong, wala na din po kasi akong pera para kumuha ng lawyer 📷 halos 150k+ po nagastos ko para tapusin yung projects na yun. Sana po may makapag bigay ng advice since di ko na alam gagawin ko, sobrang nakaka depress ng ganito. Salamat po.",1,1,1.0,Advice Needed 🤔,https://www.reddit.com//r/AntiworkPH/comments/1awaxtn/legal_help_needed/,1awaxtn
2024-02-21 18:29:38,Text-only,Supervisor won't give me my holiday off,"Context: I am currently working as a nurse sa isang govt hospital in Manila. Technically, hindi bayad ang holiday duty namin instead offset ang kapalit nito. 

I've been working in this hospital for almost six months and I recently submitted my resignation letter kasi di na kaya ng mental and physical health ko ang working conditions (nurse-patient ratio is usually 1:15-20 considering na nasa ward pa kami niyan. Bukod pa ang intubated at critical patients na hawak mo. Tapos unhealthy din ang shifting schedule. Etc etc) 

So ayun na nga, effectivity ng resignation ko is mid March. I told my supervisor na baka next week na ako mag last day of work kasi gusto ko gamitin ung earned vacation leave credits ko at holiday offset. She blatantly told me na I can't use my accumulated holiday offset kasi bago daw ako and apparently new staff cannot use their holiday off until after 5-6 months. I told her na I still have 5-6 days of accumulated holiday offset since October and hindi ko daw pwede yun magamit before I resign. Sobrang unfair nito sa part ko kasi I worked my ass off during those holidays and di ko naman hiningi yun. She's reiterating na pag binigay niya saken yung holiday off na yun unfair daw sa mga bago na di niya binigyan ng holiday off. I told her na resigned na ako at ano yun thank you na lang? 

May mga government employees ba dito? Please enlighten me kasi ginagawa akong tanga nitong bisor ko. It's my right naman as an employee to have all those hard-earned holiday off considering na hindi naman kami bayad doon. 
",1,1,0.6,Advice Needed 🤔,https://www.reddit.com//r/AntiworkPH/comments/1aw8wmo/supervisor_wont_give_me_my_holiday_off/,1aw8wmo
2024-02-21 12:11:19,Text-only,SSS Employee Compensation on Accidents,"Hello. I just want to know if the accident happen on the way home if it's still covered under SSS EC?

This is what happened.

I was sent by my boss to attend a seminar. While I was waiting for a taxi in the lobby of the hotel a dog attacked me out of nowhere. It was a stray dog so I had to be inject with Anti-rabbies.  It was a thursday afternoon and friday was a holiday so I had to do it in a private clinic that caters Anti-rabbies injections. I informed my boss on the day of the accident and the HR by monday. HR said to file SSS Sickness Benefit. I filed by wednesday but SSS email me to do email me additional documents. Now the HR didnt re-submit the documents saying it was already a late submission. 

Honestly, I am pissed off coz and wanted to go to DOLE to file a complaint but I need to know if my situation is valid. HR said that it's not covered since it happened on the way home. 

Hope someone can help me with some info.",3,2,1.0,Advice Needed 🤔,https://www.reddit.com//r/AntiworkPH/comments/1aw2of2/sss_employee_compensation_on_accidents/,1aw2of2
2024-02-21 15:46:09,Text-only,Late for 5mins due to fever and suddenly ako na yung burden.,"So yung task na supposed to be done by me, ibang tao gumawa, like 5 mins akong late due to me having a fever, hindi ako nagfile ng leave kasi need na maacomplish yung task asap. 

Kelangan b talagang isupalpal sa mukha ko na ""hindi ko ginawa yung assigned task sakin thus being a burden to them? "" Hindi naman connected sa work nila yung task ko, and lalong hindi sila maapektuhan if i fail to comply.  (Jusko 5mins lang akong late nalugi yung department(sales) nila ng 1bazillion😆)  hindi din magkakaissue if pinatro ize or praise or overly thanked them for being nice and doing my work during my 5min of lateness (sorry pero ayoko, kahit kailangan nila ng daily assurance na needed sila sa mundong earth) 

And then nagkaroon ng announcement,  bawal daw yung nagheadset😆(once, nagheadset ako once kasi nakakarindi na! And hindi na nakalimutan ang issue. Pano kaya pag sinumbong ko sila na nag sashopee and lazada games sila every minute every hour😆) another announcement ay regarding ulit sa mga task, do our own task daw to be not a burden to others, sino kaya yung mga papansin na gumagawa ng task na hindi kanila. Again need mila ng assurance na kinakailangan sila sa earth, na may halaga sila sa earth. 

Palibhasa di kuntento sa marriage life nila(yep nagku.kwentuhan sila regarding dun, puro sila reklamo, ayaw namang hiwalayan, asa sa pera ng mga asawa, dami kasi nilang utang😆).

",1,1,0.67,Rant 😡,https://www.reddit.com//r/AntiworkPH/comments/1aw6hk7/late_for_5mins_due_to_fever_and_suddenly_ako_na/,1aw6hk7
2024-02-21 15:36:43,Text-only,Vestas,Anyone here working in vestas  kamusta po environment and salary?,1,0,1.0,Discussions 💭,https://www.reddit.com//r/AntiworkPH/comments/1aw6ciu/vestas/,1aw6ciu
2024-02-21 14:16:54,Text-only,"Natawa naman ako sa "":P""","&#x200B;

[Pero napapangitan ako overall ng listing na ito. Lalo na yung preference na dapat galing Big 4? lol. May kukuha kaya ng ganito?](https://preview.redd.it/frhw7tbgrvjc1.png?width=617&format=png&auto=webp&s=e9454dfe532f61d1e5ee680c79a9f6d85ee9c15e)",1,5,1.0,Discussions 💭,https://www.reddit.com//r/AntiworkPH/comments/1aw50vo/natawa_naman_ako_sa_p/,1aw50vo
2024-02-21 04:15:01,Text-only,"Compliment Daw kasi yun, a matter of Miscommunication","Staff ako sa isang maliit na company, and i can say na magaling ako sa trabaho ko. May dalawang branch yung company namin and this week may training ang mga staff on both branch.

Nagkita kami nung isang staff sa kabila last monday tas may nakwento sya saakin. Tinanong daw sya nung training coach nila dun kung kilala daw ba ako, ""yung staff na astang bisor sa kabila"" sabi. 

Natawa ako kasi di ko pa naman naman nameet yung training coach sa kabila panu sya nagkarun ng ganung comment sakin. Ako yung tipo ng empleyado na di nakikifriend sa mga workmates, and nakikialam sa mga isyu nila sa buhay. So pinag isipan ko kung anong gagawin sa ganung comment noh. Although i dont really care kung anuman sinasabi nila sakin pero gusto ko icall out yung chismis just to let the know na alam ko na pinagchichismisan nila ako, para lang din iintimidate lang sila. haha

So ito na nga, kinaumagahan nung pauwi na ako at nasa pantry yung training coach sa branch namin tas yung 2 sa kawork ko tunanong ko si training coach kung sino yung training coach sa kabila. Sabi ko ""pinagchichismisan nyo pala ako noh?"", at sinabi ko yung context nung kwento sakin ng staff sa kabila. 

Nakita ko yung gulat sa mga mata nya, sabi nya wala naman daw syang kinukwento doon. Sabi ko naman wala naman akong pakialam kung anong tingin nyo sakin, ginagawa ko naman ng maayos trabaho ko, go lang kayo chumismis. And i left. 

I felt proud of myself actually, feeling ko naachieve ko yung goal na wag maging defensive at the same time icall out yung chismis.

But, suddenly pag datung ko ng bahay tumawag yung staff sa kabila. Kinausap daw sya nung training coach nila. A matter of misunderstanding daw. It was meant to be a compliment daw kasi. Magaling daw ako magtrabaho na kaya akong iwan ng bisor parang sa bisor na daw yung quality ng work ko. 

Andami kong tawa. Di ko alam kung totoong compliment talaga yun or binago lang yung kwento dahil sa pagmamaldita ko. Sinabi lang ba na i was meant to be a compliment kasi nicall out ko yung chismisan nila or it was really a compliment and i was asshole? haha. 

Di naman siguro ako asshole no? 😆😆😆",6,1,0.75,Story 🗣️,https://www.reddit.com//r/AntiworkPH/comments/1avrjqv/compliment_daw_kasi_yun_a_matter_of/,1avrjqv
