Timestamp,Content Type,Title,Content,Upvotes Count,Comments Count,Upvote Ratio,Flair,Permalink,Reddit ID
2024-01-24 19:42:58,Text-only,"Accused, yet eventually pursued to be the other woman of a high ranking officer","I, F26, is accused of being the other woman of a high ranking officer. Nakakanginig yung part na this rumor is spreading like a wild fire burning me to ashes. 

This all started when I got the regularly position, and had particularly special treatments from our boss. Automatically when I joined their office, I got privileges (I admit) and doing his dirty works. He invites me with almost all his whereabouts. As a newbie to their office I have no choice but to affirm kasi work-related naman - as of my perspective.

I NEVER ASKED EVEN A SINGLE ONE OF THOSE.

I've been working really hard since my first day of work as a contractual in other office connected to the boss I mentioned above. That, paved my way on getting my regularization.

Yet, because of how that boss treat me in the office, rumors began to swarm about us having a relationship. Gossips then reached to our boss' end and he provocatively announced during our meeting that all rumors are false and I am just competent worker the office needed most.

Here's the catch.

He became more and more stingy towards me. He even invited me personally going out, the first time he did this I was shocked that we were alone - I just let it slip out kasi wala talagang malice sa akin this is all just part of the work, I supposed.

I realized that everything was wrong when he asked me about my lovelife. Upon confirming my status as single, it must have became his affirmation of my availability to be his. Yuck. He  begun saying delusional things as if he is my boyfriend.

RIGHT THERE AND THEN, HE CONFESSED THAT HE LIKES ME AND WANTS US TO BE REAL 🤢

That became a trauma. I cried for several hours, asked my friends for advices. I then decided to ask for help from my previous boss.

I cried my heart out in front of her and asked for help. She was furious of course and took the concern personally with my boss at that time. After days, I was transferred back to my previous office. 

I thought the storm was over, until two weeks ago. He demanded me to return to his office as his executive secretary. He said that he will publish an official order for this matter. My now-boss still defended me and made sure I will be in a safe working space. An Official Order was published last monday confirming that I'll still remain with my now-boss' team.

The plot didn't stopped there yet, mukhang may i-kikwento pa ako. I just need to resolve this first.

I think this is a NSFW post. Im still new here, I didn't know exactly to how to use this tag.",6,3,0.8,Story 🗣️,https://www.reddit.com//r/AntiworkPH/comments/19ef784/accused_yet_eventually_pursued_to_be_the_other/,19ef784
2024-01-24 21:55:42,Text-only,Discrimination at this company,"&#x200B;

[Cannot process your application daw kapag pregnant? Paano kapag pregnant ako irretract niyo?](https://preview.redd.it/f81ajghh7eec1.png?width=720&format=png&auto=webp&s=fb2c501fef261b79a9c60a063c83158b80bfa6c9)

  
Orbit Teleservices what is going on?",2,8,0.75,Company alert 🚩,https://www.reddit.com//r/AntiworkPH/comments/19ehmyl/discrimination_at_this_company/,19ehmyl
2024-01-24 19:43:11,Text-only,"Kapag natanggal ba ako sa trabaho dahil sa ""poor performance"" aka, di talaga gaanong marunong pero nagsusumikap itama ang trabaho ko, yung mga BPO companies ba, tatanggapin ba ako, given na wala akong bad record?",,3,5,0.67,Advice Needed 🤔,https://www.reddit.com//r/AntiworkPH/comments/19ef7bs/kapag_natanggal_ba_ako_sa_trabaho_dahil_sa_poor/,19ef7bs
2024-01-24 11:23:29,Text-only,Ang hirap pala maghanap ng work. kapag may disability ka.,"Nag apply ako sa isang hotel around makati, and the position that I am applying for is Marketing. Nakapasa ako sa intial and final interview and had already signed a job offer. Nakapag down na ako sa apartment & mags start na lang sana sa work ng feb.

However, naging hesitant yung isang higher up dahil nalaman na I am diagnose with Bipolar I. Nalaman nila ito dahil sa pre-employment medical exam. Ang worry ng HR and owner is the working environment and how I will handle rejections. (tinawagan naman niya ako how I work and handle stress)

Sa interview, di ko minention ang condition ko dahil wala naman silang naitanong about that and I think, di naman necessary to know that kasi given na yung job description & nature of work, I know na I can do it naman. Rather than seeing my abilities and skills, naging hesitant sila ng dahil sa condition ko... it sucks... yess.. but by the end of the day- work is work and syempre as someone who goes to monthly therapy- i learned how to cope. I know they are just worried about my condition, pero sana they view my skills and abilities as someone who is capable in working sa ganitong position.

Right now, naghahanap ako ng work within the area since nakapag down na ako sa apartment. Hopefully may tumanggap sa akin 🙏",9,8,0.91,Discussions 💭,https://www.reddit.com//r/AntiworkPH/comments/19e7dek/ang_hirap_pala_maghanap_ng_work_kapag_may/,19e7dek
2024-01-24 22:06:47,Text-only,UNFAIR,"Oo unfair Yung company Kung saan ako nagwowork.
Strict daw sila sa rules and Fair daw
 pero pag kamaganak lang okay lang kung delayed ang lahat.
Okay Lang Kung Di maipasa ang Mga requirements Kasi kamag anak Nila.
Pero pag loyal clients or customers nila Di Nila maconsider.


Mga HIPOKRITO",1,0,0.67,Rant 😡,https://www.reddit.com//r/AntiworkPH/comments/19ehvkl/unfair/,19ehvkl
2024-01-24 11:06:57,Text-only,Less than a month and gusto ng manager na alam ko na lahat,"Idk if it's her way to push me pero nakaka-offend na mga comments niya. Nagkaron kami ng meeting na hindi siya masaya sa performance ko. Hindi daw mataas na mark bibigay niya sa evaluation ko. Wag na daw ako magulat if bagsak ako. I'm doing the associate tasks at the same time ginagawa ko din yung tasks ko as a supervisor. Where I work, ako na top ng department namin. Lagi akong OT ng more or less 3 hours a day.

Nung tumutulong ako sa associate sasabihin sana nag-associate na lang ako. Unahin ko daw yung mga dapat kong gawin. Nung hindi ako tumulong sasabihin wala akong initiative. She even claimed na may nagsabi sa kanya na wala daw silang natutunan sakin. Pero lagi kong kinakamusta mga associates ko and kung may natutunan sila. Every duty ko yan tinatanong. Lagi ako nanghihingi ng feedback sa kanila tungkol sakin, sa performance ko, paano ko sila matutulungan. Nagbibigay naman sila ng feedback na ginagamit ko for the betterment ko and maging mas smooth yung flow ng department. Di ko alam kung saan niya hinuhugot yung mga ""sinabi"" daw sa kanya. Either my associates lie or gumagawa lang siya ng issue.

Pinagawa niya ako ng guidelines and procedure. Sabi daw sa kanya sinabi ko daw na aayusin ko muna yun bago ko ayusin yung department. I never said that. And why tf will I say that? Since nag-start ako wala akong ginawa kundi mag-isip ng way para maging mas magaan trabaho ng mga tao. Maging mas maayos yung operation.

Sabi ko nga sa mga associates ko, wala akong mapapala kung fear yung ma-iinstigate ko sa kanila. Lalo lang sila magtatago ng mga mali nila. Hindi sila magiging vocal sa mga gusto nila. Ayoko matakot sila sakin. And may openness sila sakin ngayon when it comes to things na sobrang naa-appreciate ko. Tinutulungan nila ako, at the same time natutulungan ko din sila. 

I don't think it's bad to be good. Bawal na ba maging good person sa trabaho? Masama na ba maging mabait?",6,2,0.88,Rant 😡,https://www.reddit.com//r/AntiworkPH/comments/19e71fv/less_than_a_month_and_gusto_ng_manager_na_alam_ko/,19e71fv
2024-01-24 10:14:55,Text-only,A Software Developer's Rant,"Hello, I just wanted to rant something. This is my first time on this sub and oh boy it does indeed fuel me to press on ranting even further. When I started at this company, it was really fine. We were working an output based role, basically I'd finish a whole week's task (based on the given sprint timeline) within 2-3 days. These days, we're now getting monitored per the hour and is expected to consume all 8 hours of the day. To explain, it tracks your tasks for the day and it should amount to 8 hours. The thing that got me is that I've been told by those above me that it should be 8 hours and above, not below. Also, FYI, it is not counted as overtime since they said that if we count it as overtime, we are ""not utilizing"" our 8 hours. Any thoughts?",7,19,0.89,Rant 😡,https://www.reddit.com//r/AntiworkPH/comments/19e5yjf/a_software_developers_rant/,19e5yjf
2024-01-24 06:31:10,Text-only,"Nawalang increase, Philhealth and PagIBIG","Nakakaasar lang! Bago ang lahat gusto ko muna kumanta ng ERE!

🎵Oh diba! Nakaka putang INA!🎵

Ayan, potek nakakagigil. Ayun nga, so last year, nag increase ang sahod ng mga minimum wage earners. Bale 610 na siya ngayun diba.

Tapos pagpasok ng putang inang 2024, una muna inanunsyo ni Philhealth na mag iincrease sila ng contribution, sa isip ko okay lang kaya pa naman, tapos lately lang putang ina, nag increase din si pagibig, yung dating 100php n contribution ko naging 200 na amputang ina, wala naman sana masama kase para satin din yun, kaso ang putang inang sahod natin ganun parin ulit, nabawe amg lahat ng tinaas netong mga makaraang taon.

Sana namam ma realize yan ng mga nada taas, kase putang ina sarap kumanta ng putang inang ere pag ganyan haaays.

Kayo ba anu ang say niyo dito?",11,3,0.92,Rant 😡,https://www.reddit.com//r/AntiworkPH/comments/19e12gq/nawalang_increase_philhealth_and_pagibig/,19e12gq
2024-01-24 19:20:31,Image,May mga katrabaho akong tamad pero sila pa yung mapanira nang kapwa,,1,2,0.6,Story 🗣️,https://www.reddit.com//r/AntiworkPH/comments/19eeujk/may_mga_katrabaho_akong_tamad_pero_sila_pa_yung/,19eeujk
2024-01-24 08:27:12,Text-only,Requesting a copy of my payslip before their offer,"Nag apply ako sa isang malaking company na kulay blue, natapos na ang initial interview and then na-schedule na ako for the technical interview. Then, nag email si HR requesting a copy of my payslip as a requirement before the technical interview. Should I send a copy or ipaglaban ko na confidential ito?",4,8,0.83,Advice Needed 🤔,https://www.reddit.com//r/AntiworkPH/comments/19e3pb3/requesting_a_copy_of_my_payslip_before_their_offer/,19e3pb3
2024-01-23 17:04:41,Text-only,WNS is the WORST BPO company I've ever worked for,"I just want to rant about how lack luster and unprofessional WNS is as a company. Hindi ko po kasi alam kung buong WNS ba ang magulo, or ang account ko lang. Itago nalang natin ang account ko as a Travel Account. Ang site ko po is South of Manila. 

The account itself ay madali sana. I've been part of the leadership team before with other companies, and I decided to stand-back due to personal reasons. Ngayon lang ako nakakita na sobrang unprofessional na Team Leaders and SME's (Not all, but most). Not just that, pati Work Force napaka angas. Using the 'Gay' card as a form of immunity against sexual harassment in the office. Ultimong QA nga din, pag nakita niya nakakatawanan mo yung trip niya sa office, automatic ZERO ka sa QA score mo.   


There's no platform to voice out your concerns and feedback. Ang masaklap pa diyan, your feedback isn't anonymous.  Merong monthly feedback na kailangan isubmit. If you give them a low, it'll prompt you to write something on what they can improve, ang problema lang, your name and Employee ID is visible to Senior Managers. Pupuntiryahin ka kapag nagbigay ka ng low score. HR is virtually non-existent. Hindi mo ramdam at laging papalit palit ang HR. I spoke to one of the HR's before they resigned and they said that the account itself is fucked up. There are a lot of client visits every quarter. Pero like most Pinoys, best foot forward pag andiyan ang client. Kiss-ass. Tas pag-alis ng mga clients, back to the normal na ka bullshit-an. 

&#x200B;

OT is shoved in your throat. Madalas ang 6 day work-week. If you tell them that this isn't in par with DOLE's Labor Code, they'll give you a bullshit explanation, tas guguilt trip-in ka. 

&#x200B;

This is my 6th BPO company, and never have I experienced this before. Baka nga mas malala pa sa ibang company, but this is my two cents.

&#x200B;

If you plan on applying, choose a different company.",44,167,0.92,Rant 😡,https://www.reddit.com//r/AntiworkPH/comments/19dk9sn/wns_is_the_worst_bpo_company_ive_ever_worked_for/,19dk9sn
2024-01-23 21:53:11,Unknown,- MANILA BULLETIN FB page,May redditor na taga Manila Bulletin pala rito 🙃,13,17,1.0,Discussions 💭,https://www.reddit.com//r/AntiworkPH/comments/19dowlb/manila_bulletin_fb_page/,19dowlb
2024-01-23 13:41:39,Text-only,padrino systems in the government need to stop,"applied for a job vacancy in the government yesterday. can't remember if they were three or four men yesterday but they look at the same ages and magkakakilala. saw one guy's CV and he's a fresh grad tapos walang job experience aside sa internship sa isang not so familiar company but i believe it's a private company. two of them applies to the same position as me. the other, hindi ko sure if what position. 

so as the other staff checks my documents, the other lady told the 3 to 4 guys na they are scheduled for an interview next week so i was expecting na yun din sasabihin sa akin after i-check ang documents ko pero natapos na ang lahat, walang sinabi ng date ng job interview ko. what gives me more ick ay may namention yung other lady na ""sabihan ko na lang si 'SIR' na nagpasa na kayo"" so grabe napa sideeye talaga ako. 

both of us have Engineering degrees and unlicesed but if you will compare our job experience, i think i have way better experince naman. hindi sa pagbubuhat ng sarili kong bangko but i have a almost two years experince sa dalawang construction companies and a job experince sa isang environmental NGO na which is very suited for the job position by the way since the position i am applying for is agriculture-related and requires to immerse in the community. isang beses palang ako nagtake ng board kahit 2020 pa ako nag grad. reason: need talaga kumayod. last boards na nagfail ako ay i was so mentally unstable kasi 50/50 non ang medical condition ng father ko after ng accident. 

wala lang. i am just disappointed. i can def look for other job position but (1) nakakahinayang rin kasi yung sahod kasi di mo yun madaling mahanap sa mga private companies, (2) need ko din talaga ng pera since kailangan pampagamot ng father ko and (3) ilang katulad ko pa kaya ang hindi nabigyan ng chance sa isang job vacancy ng mga government offices  dahil sa padrino system. 

this is so frustrating. but i guess ganito talaga ang buhay. kailan kaya magbabago ang pinas. 

segway: if anyone knows a job opening or any wfh jobs na pwede ang engineering grad (i have bpo experince too), let me know. really need money for my father's physical treatment. <3",52,22,0.95,Rant 😡,https://www.reddit.com//r/AntiworkPH/comments/19dh9qe/padrino_systems_in_the_government_need_to_stop/,19dh9qe
2024-01-24 10:15:19,Text-only,Training Contract 12k,Hello po. Ask ko lang po? May training contract na pinirmahan ako at hanggang March 2024 lang. Pwede na po ba ako umalis at di na pumirma kapag pinapirma ulit ako by march pag end ng contract? Sabi po kasi ng iba kong kawork may exit interview pa raw po??? And lagi na raw yan delayed kapag magsisign na ng contract after training. Hindi na po kasi nacocompensate ng 12k per month ang expenses namin sa bahay. Hindi rin po ako makatanong sa HR since may friend po ako dun and baka maging issue pa po.  Salamat po sa sasagot.,1,10,1.0,Advice Needed 🤔,https://www.reddit.com//r/AntiworkPH/comments/19e5ytu/training_contract_12k/,19e5ytu
2024-01-23 22:24:47,Text-only,Unfair.,"Sorry this is just a small rant. If it doesn't fit here, delete. I worked for a government agency as a kob order for almost 6 years, job order ang position, regular work ang banat, for a really discounted salary compared to theirs. All that time, meron na akong csc prof eligibility. Every time may opening, apply, apply, almost always coming in 2nd or 3rd, sa ibang branch na inapplyan na priority ang JO nila, syempre absorption. Pero last year, i apply for this position na nag open sa branch namin, pero wala pa lahat. Everything pointed that I wouldn't get it, even ung mga ka trabaho ko ang immediate response is sige lang next time marami pa dyan. I lost to my officemate, who was already a regular employee. To be fair, I had my fair share of being unpleasant. Over the years tumaas ang absentism ko, when a dear family member died, I went to a deep depression that almost broke me and my family. Until now ang hirap mag hanap ng trabaho, I'm getting this response na dapat kasi hindi ka nag resign, accept na lang natin kahit di tayo ma regular basta may work. I just wanted recognition, appreciation and an opportunity to move my career. It was too much for me to take, I loved it there pero.. anyway I understand the stupidity of my actions. I wouldn't mind at all your negative comments. I just wanted the chance to take this off my chest without the thought na may makaka kilala and would forever look at me negatively.
Good night.",5,4,0.86,Story 🗣️,https://www.reddit.com//r/AntiworkPH/comments/19dpk7r/unfair/,19dpk7r
2024-01-23 12:00:36,Text-only,Most unprofessional company I've experienced,"I applied for this company last November and took an exam but unfortunately I didn't make it. Fast forward to December 28-29 (not sure about the exact date), they called me for another job and said I was interested even though sobrang baba ng sweldo and 4 mos lang ako magttrabaho sa kanila. We setup for a final interview last January 2 and medj off lang sakin kasi buong interview naka off yung camera nung mga nag interview sakin and as usual I let it slide, inisip ko na baka mahina internet or what. Natanggap ako a few days after pero ayun nga, hindi pa ko fully committed sa kanila because of the initial offer. What made it worse is the contract; I'd work for them 2 months (nyeta anong exp makukuha ko dun) and didn't even declare a night differential pay since I have to work for them in night shift. So, I asked them about the contract kasi hindi talaga tugma yung napagusapan sa ano yung lumabas sa contract and it took 3 employees to answer my questions na kahit sinong HR makakasagot nun. Tapos etong recruiter na nabanggit ko earlier, parang pinamumukha nya pa na hindi ako nakikinig sa pinagusapan namin. To end the day, another employee talked to me and explained the whole situation and it made my decision to not go with their job offer. Ewan ko kung ako lang pero sobrang off na nung sinabi ko na sa kanila di ko na tatanggapin yung offer, ni isa wala akong nareceive na thank you and good luck sa kanila. Yung isa, sineen lang ako sa Viber, yung isang HR di na ko pinansin after my last question reg the contract, tapos nung sinabi ko sa recruiter na di ko na kukunin, pinagpipilitan nya pa rin yung gusto nya. Tapos nakareceive pa ko ng email kahapon ng company orientation kahit na matagal ko nang sinabi na di ko tinanggap yung offer nila.",20,14,0.95,Rant 😡,https://www.reddit.com//r/AntiworkPH/comments/19dfhe5/most_unprofessional_company_ive_experienced/,19dfhe5
2024-01-23 18:28:35,Text-only,si boss na may favorite,"Alam kong maraming taong may experience ng may mga boss na may favoritism. but here’s my story.

i’m working in a private company and i’m one of the head ng brands under our company and nasasalaula ako sa favoritism ng boss namin. andaming projects, proposal, requests na dinedecline or disapprove niya even we have valid reasons and justification about our projects. but when it comes to her “favorite”, lahat approve niya, sometimes even if it exceeds our budget. 

i really love my job here, pero dahil sa ganung practices niya, naapektuhan na yung work namin even me, personally, don’t have a sense of fulfillment anymore dahil palaging hindi okay, or kung okay man, may papalitan siyang major na makaka affect sa project. this is not just me, but the other heads as well. totoong sobrang okay ko sa work in terms of salary, convenience, work load. sadyang yung ganung practice lang di ko keri. 

napapaisip na din ako maghanap ng ibang work but i can’t trade the convenience kasi ang lapit ko lang. idk what to do anymore",6,3,1.0,Rant 😡,https://www.reddit.com//r/AntiworkPH/comments/19dlfwn/si_boss_na_may_favorite/,19dlfwn
2024-01-24 01:58:40,Text-only,Pa-rant lang,"Shout out nga pala sa chief namin, na willing i-pahamak ang tao niya para lang maging malinis siya sa mukha ng pinaka-boss namin.

Nashow-cause order ng halos lahat sa departamento sa amin, dahil nahuli ng pinakaboss namin ung natutulog na empleyado, so akala namin siya lang, pocha halos 95% ng tao nabigyan ng show cause order, pero hindi na namin yon minamatter and dinidiin yung empleyado na iyon.

Nakalagay doon sa show cause order na NEGLECT OF DUTY kami, despite na may output naman kaming nilabas, so ung mga assistant boss namin, willing kaming tulungan sa department namin at nagpatawag ng mga meetings. Maraming beses kami nang mineeting pero etong dalawang meeting na ito ung tumatak talaga dahil sa kanya.

2nd meeting namin with the assistant boss, normal na usap lang na bakit ganon and explain naman kami na ginagawa naman po ung report namin, with matching evidence naman. (Tho isang specific duty lang naman pinakita and nakita, hindi pa kasama ung other scheduled duties) na walang nangyaring neglect of duty sa mga nadamay. 

After non, may inutos siya na, ikaw chief, may ganito naman palang problema, dapat tulungan mo ung tao mo, nirereport naman nila ung insidente sa iyo, bakit di nagagawan ng paraan? Ung ibang report, pa-generate naman. 

 ETO UNG LINYANG TUMATAK SA AMING LAHAT. 

""BAKIT AKO?""

Sinupalpal siya ng assistant boss na ANO BA? TAO MO YAN AH? TULUNGAN MO NAMAN YAN AT MGA NAKAYUKO NA.

""YES PO.""

Ginawa naman ung report, pero feel namin na napilitan lang siya sa pag-gawa non. After ginawa ung report. Except kay chief, sabay-sabay na kami na nagsubmit ng explanation sa Internal Department. Saktong dumaan ung lawyer doon na assistant boss din namin at may idea siya sa nangyari and kinausap kami ulit. Ginuide naman kami sa paano ung paglalagay sa Show Cause Order namin, and nagexplain naman kami kung ano ung nangyari and sabi niya, revise ninyo to, so okay lang naman yon para atleast mahelp kami. 

Habang nag-meeting kami, nag-submit na din pala siya ng response sa show-cause and pinatawag din siya. Tumabi siya sa akin and pinakinggan na ung mga sinabi namin.

Alam ninyo ung body movement niya na galaw ng galaw, hindi mapalagay, kinakamot ulo lagi like bruh ganyan ka pala and halos kinokontra lahat ng sinasabi nung lawyer.

Then sinabihan din siya na ikaw chief, tulungan mo sila sa pagrerevise kasi malalagot yang mga tao mo na yan. 

THEN GUESS WHAT, SHE SAID THE LINE AGAIN.

""BAKIT AKO?""

Kahit katabi ko boss ko, napatingin na lang ako sa isang katabi ko eh.

Hindi nagsalita ung lawyer sa kanya, nung nandon pa kami. Nagsalita siya nung pinadisperse kami at pinaiwan siya.

""Ano ka ba, ikaw ang boss ng mga ito, alam mo bang subject for dismissal yan mga yan tapos kinontra mo pa ako?""

Sabi nung chief namin: Joke lang po.

YEAH JOKE LANG PO. JOKE LANG NA MAWALAN KAYO NG 95% NA TAO? JOKE LANG DIN PALA NA NAGKAKAIYAKAN NA LAHAT DITO TAPOS JOKE PA DIN PALA? 

Kaya ayon, low morale na ang tao, halos leave na ng leave ung mga tao don, di na totally nakikinig sa iyo, marami nang gusto mag-resign or lumipat ng department, wala nang ganang mag-work.",0,0,0.33,Rant 😡,https://www.reddit.com//r/AntiworkPH/comments/19dufbw/parant_lang/,19dufbw
2024-01-23 18:21:38,Text-only,"Qc, Makati, Taguig or Pasig","I am from Province and I am here in Sampaloc Manila for my CPA review, sad to say I need to find a job kasi pang 3 months nalanh budget ko and din na kaya mag pure review. Alin sa mga cities dyan ang most amenable to work considering yung pag cocomute?",3,5,0.81,Advice Needed 🤔,https://www.reddit.com//r/AntiworkPH/comments/19dlcfv/qc_makati_taguig_or_pasig/,19dlcfv
2024-01-24 09:53:23,Text-only,Yung paniwalang paniwala kana sa Post about doon sa HR pero nalaman mong Rage-bait pala.,"Out of nowhere napaganda yung post ng Manila Bulletin para malaman na copy pasta lang pala yung post, mas mabilis na identify.

Orig post:
 https://www.reddit.com/r/BestofRedditorUpdates/s/QtLnzGVbwM",0,25,0.47,Discussions 💭,https://www.reddit.com//r/AntiworkPH/comments/19e5iaa/yung_paniwalang_paniwala_kana_sa_post_about_doon/,19e5iaa
2024-01-23 09:25:22,Text-only,FROM FULL TIME ginawang Part Time Employee na walang transition.,"So, I was a full time employee for a year then bigla nila kami ginawang part time employee. And naguguluhan lang ako sobra sa proseso at wala man lang rendering ng full time bago magpart time. This is my first job as a fresh grad, and 1 year pa lang ako wala pa ako masyado ipon at nagrerent ako ng apartment sa manila, hiwalay pa bills. I asked the HR before sana magbigay siya ng update samin kasi di naman pwede yung biglaan na lang. Then, nagmessage sakin ang boss ko, naghihingi ng desisyon sa akin kung ano raw gusto ko. Syempre ako gusto ko maging full time employee,  na may benefits. He gave me 2 options but Full time is not even in the choices, ang weird lang rin na pabato bato sila ng desisyon kung kanino ba Talaga. I dont know what to do na rin. First company job in Manila, ang ganda rin bungad ng 2024. May advice ba kayo like, sana makakuha man lang ako ng compensation bago nila ilipat ako sa Ganung sistwasyon.",12,7,1.0,Advice Needed 🤔,https://www.reddit.com//r/AntiworkPH/comments/19dceej/from_full_time_ginawang_part_time_employee_na/,19dceej
