Timestamp,Content Type,Title,Content,Upvotes Count,Comments Count,Upvote Ratio,Flair,Permalink,Reddit ID
2024-01-08 02:46:56,Text-only,3 year employment bond at rustans / stores specialists inc,"
So i’ve been working at rustan’s now for about 2 years and have been hating the job for awhile due to the intense workload and stressful work environment. Its been so crazy! We work overtime with no pay and even on weekends. 

I’ve been thinking of quitting for the past 3 months but haven’t had the heart to do it due to the 100K 3 year bond… 100k is a lot of money that I don’t have, but i’m honestly willing to risk it as its not worth it na talaga to stay for another year. 

Pay is low, benefits are lacking and company politics is such a big thing! The company’s so traditional that everything is manual. Although I love working with my work friends, but the work load is just too much. We don’t even have sweldo increase! I’ve been having serious anxiety due to this job na. 

Has anyone worked at rustans or ssi and did not finish the 3 year bond period? Where you required to pay the 100k bond? Please I just need some insights so I can make an informed decision. If you’re too shy to reply, you can send me a DM. I would really love to speak to someone who understands this dilemma I’m having :( huhu I don’t think I can survive another year at this company.",11,17,1.0,Advice Needed 🤔,https://www.reddit.com//r/AntiworkPH/comments/190z5n1/3_year_employment_bond_at_rustans_stores/,190z5n1
2024-01-08 18:49:20,Text-only,Interview over the phone call,"Hello! Has anyone from you that you have been interviewed by calling thru your mobile phone?

Context: Naghahanap ako ng work. Job hunting sa ganitong company and so on. I got interviewed face to face and video conferencing (like google meet and zoom).

I was recently got a message from the HR that the interview will be conducted by calling me using my mobile phone. First time ko lang naka encounter ng ganito. Naiisip kong dahilan kung bat ganoon ay siguro company policy nila.

Has anyone experience this? How was it?",0,8,0.4,Discussions 💭,https://www.reddit.com//r/AntiworkPH/comments/191iiil/interview_over_the_phone_call/,191iiil
2024-01-07 07:59:55,Text-only,BOSS OFFERS THE REMAINING OF THE 13TH MONTH AND CALLS THEM DESPERATE,"HELLO EVERYONE, I JUST WANT TO RANT ABOUT MY COMPANY.  SOME MIGHT KNOW WHICH COMPANY IS THIS, IF YOU KNOW, YOU BETTER LEAVE IMMEDIATELY.  


I will get to the bottom of it agad, because of poor management of the bosses, laging 50% on cut off yung salaries namin, yung the rest umaabot pa ng 3-4 days bago ma bigay. 13th month namin yung iba di parin na bibigyan. then we found out na yung government mandated benefits almost 1 year nang delayed. deduct sila ng deduct pero di nila ni reremit. then nung isang araw, yung isang kasama ko inofferan nang half sa 13th month nya para basta lang di na magsumbong sa dole, tinanong nya kung bakit sya lang, sabi ng boss siya lang daw mukhang desperado sa pera. which is so degrading and insulting. lagi pa syang pinag chichismisan ng asawa ng boss nya, which is the president na wala man lang alam sa company. ",63,22,0.97,Rant 😡,https://www.reddit.com//r/AntiworkPH/comments/190e5zw/boss_offers_the_remaining_of_the_13th_month_and/,190e5zw
2024-01-08 15:04:57,Text-only,Liquidated damages: can please someone explain this to me like Im a fiver years old,"Kakahire ko lang sa isang job ko, and I decided to quit agad umabsent ako kasi I feel na nahire lang ako kasi someone needs to fullfil for the position. Then I am over thinking kung ano mangyayari sakin after. Then I remember nabasa ko sa contract na ""A violation of this provision shall allow the company to claim liquidated damages equivalent to PhP 10*********** or any amount higher that may be imposed to the Company by a Third Party due to lapses that were caused by the Employees sudden exit and lack of proper turn over, and to forfeit any final pay of the Employee"" so ibig sabihin po ba noto ay magbabayad ako ng said amount?",0,16,0.27,Discussions 💭,https://www.reddit.com//r/AntiworkPH/comments/191f7a7/liquidated_damages_can_please_someone_explain/,191f7a7
2024-01-07 20:20:15,Text-only,Kasama sa point system/KPI kung lagi ka nago-OT,"Ganyan din ba senyo? Ganito raw sa dating work ng friend ko. I find it weird. Kasi ako kapag feel ko lang... dun lang ako papayag. Hindi ako mapapapilit. Parang hindi ko gusto yung mag OT ako dahil lang sa points. I know sayang din yung bayad ng OT pay/restday duty pero now, I'm choosing my peace. My dayoff. Kayo ba? And ano nirarason nyo kapag ayaw nyo mag restday duty? Haha.",6,8,1.0,Discussions 💭,https://www.reddit.com//r/AntiworkPH/comments/190qyzy/kasama_sa_point_systemkpi_kung_lagi_ka_nagoot/,190qyzy
2024-01-07 12:56:43,Text-only,"PWD, SENIOR CITIZEN, PREGNANT WOMEN, DIFFERENTLY-ABLED PERSONS LANE","Sa government and private establishments alam kong mandated na magkaroon ng special lane for PWD, SENIOR CITIZEN, PREGNANT WOMEN, DIFFERENTLY-ABLED PERSONS, kayo na nasa customer service what do you do if example, magkasama, tapos yung isa buntis, yung isa hinde, parehas silang may transaction, after matapos nung buntis, siningit niya yung kasama niya, tinanong ko kung buntis din, hindi naman daw, so pinagpila ko, ang sabi niya sakin buntis daw yung kasama niya, nagalit si ateng. 😬 

I can't find the provisions sa batas na to, basta ang nabasa ko lang kasi is may special lane for Pregnant Women, wala namang nakalagay na ""Pregnant women and their friends"" 🥲

Pag sa seniors kasi parang common sense na may kasama sila to transact for them, as long as para sa senior citizen yung  transaction.

For differently-abled naman, hinahanapan ko nalang ng ID if hindi halata or hindi agad mapapansin na differently-abled (hearing, visual impairment etc.)

So what do you think about sa pregnant women and their friends? 🥲",18,7,0.88,Advice Needed 🤔,https://www.reddit.com//r/AntiworkPH/comments/190k4xb/pwd_senior_citizen_pregnant_women/,190k4xb
2024-01-07 12:38:53,Text-only,Ayoko pa pumasok sa work pero kailangan. Huhu.,"I will be back na sa work tomorrow, Jan. 8. Yes, bukas pa lang ako babalik kasi nag-leave ako the past week. Somehow, nape-pressure ako bumalik kasi ako na ang next in line sa isang Senior role. Yung pinalitan ko, Senior na siya. And I have very big shoes to fill. I know I should be grateful pero somehow, na-anxious ako kasi I know yung pressure that comes with the expectations. Mag-2 years pa lang ako sa position ko, and I have surpassed my other colleagues na mas tenured sa akin by several years. 

Hay. Minsan nakakatamad talaga mag-work. No wonder dream ng marami maka-jackpot sa lotto. Huhuhuhu. Gusto ko lang mag-rant kasi sobrang kinakabahan ako and I gusto ko dito i-share kasi anonymous. Thanks sa pakikinig.",12,4,0.75,Advice Needed 🤔,https://www.reddit.com//r/AntiworkPH/comments/190jsux/ayoko_pa_pumasok_sa_work_pero_kailangan_huhu/,190jsux
2024-01-07 15:40:45,Image,Parcel,Di naman nila trabaho yan. Onting rant lang para sa regional manager namin na akala mo pamamanahan ng kumpanya. Le5k ko nalang din at nakakabwisit ang daming GC sa messenger gamit personal account ipapahiya ka kahit naka day off ka at di mo alam nangyayare. Umay sayo Rona.,3,3,0.67,Rant 😡,https://www.reddit.com//r/AntiworkPH/comments/190mxkk/parcel/,190mxkk
2024-01-06 22:08:26,Text-only,May mga CIVIL ENGINEERS pa ba na masaya sa work nila?,"Hello mga ka 12k!

I recently resigned kasi nang ha-harass po yung mysogynistic kong supervisor. I sent my resignation letter and he just replied with an emoji ""😌"". I sent the letter to the HR and they replied na dapat pirmahan ng gagong yan ang letter with no further queries bat ganyan reply sakin.

Anyways, 
RCE for 1 year na with 1 year exp na din.

2 Jobs down as RCE and I could say that life as CE is really not worth all the sleepless nights and studying of formulas that are not needed at work (unless struct/design). 

Init, pagod, tambak na work loads, harassment kapag nagtatanong ka di ka directly sinasagot papahiyain ka lang. Tas kung may konting issue hanap ka agad. ,""Engr, si ganito, ganyan.""

Dont fucking start with me na tamad ako kasi Deans lister ako college and ever since nag trabaho ako, 7 days lang absent ko for the entire fucking year. 

Aminado naman na may mga pagkakamali dn ako kasi nagpa uto ako sa 1 month training na job posting sa indeed. Saka hindi perfect ang pag execute ko sa job ko pero bat minamagnify nila lahat ng mali kaysa tama kong nagawa. 

6 months and no increase sa salary pero increase naman yung job titles. Dalawang trabaho tas mas lamang pa ang non CE na mga pinapagawa sakin.

I dont see CE as my dream profession anymore. Hindi na sya nakakatuwa and hindi sya viable for fucks sake. Hindi ka makakabuhay ng pamilya sa 20k na salary. ",41,37,0.94,Rant 😡,https://www.reddit.com//r/AntiworkPH/comments/1900qlw/may_mga_civil_engineers_pa_ba_na_masaya_sa_work/,1900qlw
2024-01-07 03:22:11,Text-only,Tips for “extension-proof” resignation?,"Planning to resign from my current company, which I heard from coworkers tend to ask their resigning employees to “extend their rendering for a bit” for proper turnover etc. This means going beyond the usual 30-day period. I want to make sure I dont get talked into doing that, even when I have a feeling they’ll try to.",8,7,0.84,Tips 🔔,https://www.reddit.com//r/AntiworkPH/comments/1907qgm/tips_for_extensionproof_resignation/,1907qgm
2024-01-06 12:44:37,Text-only,Too stressed out to look for another work -- Share your stories here!,"Soooo ayun. I think majority sa atin na nakaranas ng magtrabaho sa isang workplace na lahat -- management, coworkers, etc -- toxic, naranasan na rin to. 

Yung gusto nyo nang bumitaw and all, but you have bills to pay and people to support... And dahil sa sobrang toxic ng work gugustuhin mo na lang magpahinga instead na maghanap ng mas maayos na employer.

I just want to know we're not alone. Share your stories here!",33,14,0.97,Discussions 💭,https://www.reddit.com//r/AntiworkPH/comments/18zrp60/too_stressed_out_to_look_for_another_work_share/,18zrp60
2024-01-06 21:37:41,Text-only,Am I still entitled to receive sick leaves while rendering?,"Hello, I've been with an institution for a year and a half. I decided to resign last month and I'm currently on my rendering period until Jan25.

However, my new employer wants me to start working for them on Jan15 or else they'll just hire another candidate. I thought if using my leaves to shorten my rendering period but I'm not quite sure if the HR will still grant me sick leaves while on my rendering period since SL will refresh on Jan11 pa 🥹.

What should I do 😞?",4,4,0.83,Advice Needed 🤔,https://www.reddit.com//r/AntiworkPH/comments/19005ng/am_i_still_entitled_to_receive_sick_leaves_while/,19005ng
2024-01-06 11:55:59,Text-only,Ayoko na maging empleyado,Sometimes di ko na sure if ako lang ba tong di makuntento sa buhay or tama lang na i-pursue ko yung ideal life ko. Ok naman sahod and remote work pero alipin feels as VA and may fixed hours pa rin. Yung iniisip ko na life is yung may flexible work na di ako tali sa employer at di ko kailangan magpaalam kung pwede makahingi ng day off. May ganon naman diba 🥺,22,9,0.89,Advice Needed 🤔,https://www.reddit.com//r/AntiworkPH/comments/18zqsf4/ayoko_na_maging_empleyado/,18zqsf4
2024-01-06 13:26:53,Text-only,Nag-resign ako without a back up job. Here's why,"Basically hindi na ako masaya sa ginagawa ko sa previous  job ko. Regular 8-5 office job sa government, entitled ako sa mga benefits na almost the same sa regular (FYI Im not a permanent employee). Pero dahil ang dami kong workload at mag-isa ko lang gagawa nung trabaho, I found myself working during the holidays and weekend. Madalas pa akong mag-uwi ng trabaho just to accomplish my tasks on time and yet hindi ito nare-recognize ng management. Almost 4 years na ako sa institution na yun pero palagi akong hindi nakukuha for regular appointment sa government. Syempre you know naman pag sa government (palakasan). Sobrang mentally exhausted ako kasi kahit weekend may nagcha-chat sa messenger ko or sa phone number about sa work. Tapos hindi ako nauubusan ng trabahong ginagawa. Kaya napakadalang ko mag leave nun unless very important. Once na nag-leave ako, maiiipon lang nang maiipon ang trabahong iniwan ko. Unlike sa ibang department, they have colleagues who can take over their job pag absent si employee. I tried to subtly tell my concern sa supervisor ko pero yung pag-kuha ng assistant is not their priority. Tapos despite na nagpupuyat ako para matapos ang trabaho, they keep on pushing me to work faster. Indirectly nilang sinasabi na ""Nasaan na? Tapos na ba?"". May mga iba pang dahilan kung bakit ako nag-resign pero I dont want to disclose it any further. May ipon pa naman ako, naka reserve to pay my monthly bills. Since 12/23/23 unemployed na ako. Ang hirap pala mag-transition from a regular office job into a remote job. Twice na ako na-reject sa agency na inaplayan ko. Any good advice you can give me? Nilalamon ako ng negativity but as much as possible I want to be positive.

Pangarap ko talagang makakuha ng remote job. BTW, nakahinga ako ng maluwag nung nag-resign ako. Pakiramdam ko nakalaya ako sa tali. Hindi ko pinag-sisihan na umalis ako pero there are times, most especially at night, napapag-hinaaan ako ng loob. I would really appreciate it if you could share some of your similar experience.",10,9,0.81,Advice Needed 🤔,https://www.reddit.com//r/AntiworkPH/comments/18zsh34/nagresign_ako_without_a_back_up_job_heres_why/,18zsh34
2024-01-06 01:25:36,Text-only,What to do with unresponsive onboarder,"I currently accepted a job offer and signed the contract. Ngayon kinukumpleto ko na requirements ko and I have questions dito sa nago-onboard samin.

Di siya nagrereply. Sineseen lang niya messages ko. Nagemail nako di talaga sinasagot. Palusot pa niya di daw niya ako mareach. Maganda signal dito and wala akong missed calls from him

Ano po pwede ko gawin sa kanya? Sumbong ko ba sa superior niya? If yes, how do I look for it?

Mag iisang araw na siya di nagrereply and my phone messages shows ""read""

Edit: just like to add, if I have to ask again one of my questions to him, it means di na kaya istore ng utak ko yun. 27hrs nako gising kakaantay dun sa one day hiring na yun. All he can do is show a little understanding and humanity. And trabaho niya yun to assist me",5,6,0.64,Advice Needed 🤔,https://www.reddit.com//r/AntiworkPH/comments/18zc9mu/what_to_do_with_unresponsive_onboarder/,18zc9mu
2024-01-05 21:45:47,Text-only,Slow progress on self initiated demotion.,"I’m tired negotiating people in office. What I’m thinking here is to step out na. Yes di ko ginusto ung post ko. I’m earning big amount pero masaya ka ba? In financial terms I can say yes. But as a employee? Kamusta ka naman kaibigan?


Shorts story: I’m working in BPO for 8 years.  My second company its 7 years and counting. Di naman ako nag kulang sa demotion request pero what I’m thinking here is they are waiting na mag resign na lang ako. I don’t ask for update since I don’t want to get disappointed. I admit di ko ginusto ung promotion at the first place. Yung tipo na napilitan ka lang kasi wala ka na choice.


Being adult is hard. It’s time for me to pick my things and leave.",6,0,0.87,Company alert 🚩,https://www.reddit.com//r/AntiworkPH/comments/18z78cp/slow_progress_on_self_initiated_demotion/,18z78cp
2024-01-05 23:20:32,Text-only,Where to file complain?,"Saan kaya pwedeng magreklamo regarding sa employer/ company ko. Nakatira ko sa Ph pero directly hired from Thailand.

Feeling ko kasi iniipit ng boss ko yung bonus pay ko ngayong taon. Been in the company for more than 5 yrs na.

Thanks po",2,4,1.0,Advice Needed 🤔,https://www.reddit.com//r/AntiworkPH/comments/18z9aon/where_to_file_complain/,18z9aon
2024-01-05 00:21:50,Text-only,HR delayed my Final pay and Last salary due to my immediate resignation which is approved,Hr delayed my final pay and last salary and told me the reason why it is delayed is because of my immediate resignation that led them to lean man power on projects. They already approved my resignation and last day tho. Told them that it is none of my business and I just want a specific date on when can i get my final pay. Yet they kept on telling me that it was delayed because of me leaving the company while there is an ongoing project. I already did my job on the project tho. All they are going to do is just look if the project is being worked out by subcon. Already emailed ccing DOLE and they still insist about the struggles they faced when I left.,7,1,1.0,Advice Needed 🤔,https://www.reddit.com//r/AntiworkPH/comments/18yh02g/hr_delayed_my_final_pay_and_last_salary_due_to_my/,18yh02g
2024-01-04 21:39:46,Text-only,Plans during medical leave,"I would like to share a story of an IT employee who’s on medical leave and his immediate supervisor is asking full details why he is on medical leave.

Etong si employee ay merong medical condition. Now I can say di naman nag kulang ung employee like doing medical test kahit na may issue sa system ni PhilHealth and maraming hospital and clinic who’s refusing to use his HMO or HMO is not honored sa mismong facility.

Now employee explained via chat which is Viber ano ung nakasulat sa medical certificate. Photos is included on the chat as per employee. Like, ano ung medical condition. Ano ung recommendation ng doctor. Until when yung medical rest.

And here’s the best part. His immediate supervisor is asking His plans while on medical leave. Jesus Christ, kailangan pa ba malaman eto ng company? It’s clearly explained via chat what’s going on.

Idk if tanga yung supervisor or inutil ung manager to know ano ung plan ng employee while on medical rest. If you’re thinking na etong employee is cookin something, give a shot to call the clinic where the documents came from.

I admit gumawa ako ng excuse just not come to work by sending medical documents. Pero ung tatanungin ka ng plans while on medical rest. What the hell.

To his Immediate supervisor and Immediate manager, saludo ako sa inyo. “Continental Fuck You”. I hope if mag medical leave kayo tanungin din kayo ng mga tao nyo what’s your plan while on medical leave.



Credits to Kuya Jobert for his line of Continental Fuck You.",10,8,0.86,Rant 😡,https://www.reddit.com//r/AntiworkPH/comments/18ydeqo/plans_during_medical_leave/,18ydeqo
2024-01-04 10:11:05,Text-only,"Sa mga recruiter dyan, don’t invite applicants na hindi naman qualified for the post.","Sa mga recruiters,

Kung hindi niyo nilagay sa job posting na for male lang ang position, at hindi rin pwede ang currently taking post-graduate studies pero internally hindi kayo talaga inclined to hire those persons, HUWAG NIYO NA SILA IMBITAHIN FOR THE INTERVIEW PLEASE LANG. I-check niyo naman application form/CV na pinasa sa inyo, babae ba ito? Enrolled ba siya? Nagsusumigaw na details na nandyan. 
Sayang sa pamasahe, oras at effort.

Same goes for other qualifications/disqualifications na ayaw niyo i-disclose sa job posting pero internally hindi niyo talaga gusto.",65,10,0.98,Rant 😡,https://www.reddit.com//r/AntiworkPH/comments/18y1dve/sa_mga_recruiter_dyan_dont_invite_applicants_na/,18y1dve
2024-01-04 14:32:40,Text-only,Pamilya culture that prays everyday,"Okay lang ba sa inyo gantong company culture?

So I found out (from prev employee) dun sa isang company na inaplayan ko yung gantong culture na meron sila. Everyday may online meeting sila to pray and share ng goals sa buhay nila or magkwento ng kung anong meron sa buhay nila. Everyone needs to participate DAW and parang gagawing issue nung ibang TL and Seniors kapag hindi ka nagpaparticipate. Like papadalhan ng memo ganon daw. Kasi nasa final interview na ako next week and willing naman sila to negotiate sa asking salary ko. 😞",27,26,0.94,Advice Needed 🤔,https://www.reddit.com//r/AntiworkPH/comments/18y6h3g/pamilya_culture_that_prays_everyday/,18y6h3g
2024-01-04 16:47:01,Text-only,Demotivated to work,"32M here working as an ITSD L1(IT Service Desk) in QC. Been with the company for about 2years now. And every now and then, nafi-feel ko na tinatamad ako magwork, although I'm loving the job. 

Feeling ko nag-start to when the company promised our team to be promoted to L2, may pa-party and recognition pa, however didn't pushed through, kasi daw policy etc.

Plus, stagnant yung skills as L1, no trainings or certification to excel our skills. Been trying to apply sa ibang company, and sad to say, hanggang final interview then ghosted na.

Started 2024 with an SL. 🙈 sobrang demotivated na ko magwork sakanila. Di ko din mabitawan hanggat walang kapalit na work at bills are waiting 😅",14,15,0.94,Advice Needed 🤔,https://www.reddit.com//r/AntiworkPH/comments/18y8id0/demotivated_to_work/,18y8id0
2024-01-04 18:31:28,Text-only,Is this legal?,"So, I signed a contract with a bond. I will pay 70k if I resign. I filed my resignation yesterday stating my last day. My employer did not acknowledge my letter. He said my final day should be 30 days from the time that I have already paid the 70k. 

In essence, lapag muna ako 70k saka tatakbo yung 30 days then I can leave. Eh ang plano ko sana after my final day ko na bayaran or during the 30 day render period, para pagdating ng last day ko, bounce na ako. 

Wala akong maalala na ganyang specific stipulation sa contract. At kung meron man, is that legal? 

And if it is legal after all, their remedy is to file for damages for AWOL lang naman diba, so should I really be worried?",7,15,0.77,Rant 😡,https://www.reddit.com//r/AntiworkPH/comments/18ya2fs/is_this_legal/,18ya2fs
2024-01-04 14:45:02,Text-only,Thoughts on less than 1 year with employer?,"Is less than or 1-year with employer such a bad thing nowadays? The shortest stint I did is 1 month because I wasn’t satisfied with the job on top of the toxic management and work culture. Of course, I say that I wanted career growth and the company isn’t aligned with my values. I recently got interviewed and I mentioned my non-negotiable to recruiter. I  hope companies realize that while they have an upper hand, it should always be a 2-way street relationship with your employee. The longest I’ve been with a company is 3 years and 2 months because I was working with a good boss, solid collaborative team, had trainings to upskill myself aside from on-the-job experience and good benefits. But I resigned kahit I got promoted because I wasn’t given a fair chance to apply for the role I want because of recent promotion and lock-in period after promotion, and I felt I’ve outgrown yung work ko kahit na promote ako. What made you decide to leave early? or Stay longer?",9,5,0.91,Discussions 💭,https://www.reddit.com//r/AntiworkPH/comments/18y6nwz/thoughts_on_less_than_1_year_with_employer/,18y6nwz
2024-01-04 08:36:59,Text-only,when did you stop enjoying learning for the sake of it?,"Hi, not sure if this is the right sub; I guess the intention behind the question comes from an antiwork sentiment. I can't really recall when, other than at some point, I started falling to the idea that any kind of learning that has no upskill or marketing value isn't worthwhile.

This essentially sucks because I have a lot of interests that has huge learning curves (painting, languages & writing among them), while not inherently marketable. Whenever I'd get to them the thought of not being productive or efficient enough makes the process of ""just learning things"" almost unfulfilling.

Anyway I'm curious if anyone else has had these struggles and how do you get around it?",8,2,0.78,Discussions 💭,https://www.reddit.com//r/AntiworkPH/comments/18xz92l/when_did_you_stop_enjoying_learning_for_the_sake/,18xz92l
2024-01-04 14:56:34,Text-only,Backpay,"Okay lang ba na 2 months bago mareceive ang backpay if iyon ang nakalagay sa handbook? Nanghihingi naman ako ng update pero para kaming tinaboy lang na tinanggalan ng access tas wala namang nagrereply sa email (last email was sent before Christmas pa since di pa namin narereceive yung sahod for 15th nung Dec) 

Ganun ba talaga process pag na lay off? Sorry first time kasi fresh graduate din po ako.",1,2,1.0,Discussions 💭,https://www.reddit.com//r/AntiworkPH/comments/18y6ug7/backpay/,18y6ug7
