Timestamp,Content Type,Title,Content,Upvotes Count,Comments Count,Upvote Ratio,Flair,Permalink,Reddit ID
2024-02-02 09:19:57,Text-only,"Hi, i hope there's someone who can help me."," I am in a very tight and hard situation since nawala yung interest ko pagdating sa program ko pero tinapos ko. I finished my 3 years of schooling in marine transportation pero nung nasa 3rd year palang ako medyo di na talaga buo loob ko na ipursue although nung bata ako yun na yung laging kong binabanggit hanggang maghighschool ako. Ngayon, I am looking for jobs na related sa program ko but sadly medyo nahihirapan ako dahil tulad nung isa kong nabasa na here sa reddit, this is a trap since these are the programs na ""hindi"" ganon ka-related sa ibang work. I know what i am capable of. I finished the program with "" medyo high position"" kahit hindi talaga buo loob ko. i know that there are lot of jobs na pwede kong pasukan kahit hindi related dito pero nagbabakasali ako na may masuggest kayo or alam na kahit papaano related sa natapos ko. Salamat. ",8,4,0.9,Advice Needed 🤔,https://www.reddit.com//r/AntiworkPH/comments/1agrh1w/hi_i_hope_theres_someone_who_can_help_me/,1agrh1w
2024-02-01 19:11:19,Text-only,AYOKO NA!,"Ayoko ng pumasok, nakaka drain na, low salary plus ung  boss na kung ano-ano pinatutupad na batas sa office.

We got screenhot last Monday ng aming tokwa boss dahil sa palingon-lingon namin. Eh nag uusap lang naman kami ng mga katrabaho ko, random talks and asking what we should do on a particular scenario na related naman sa aming work. (minsan kasi need talaga namin mag usap since may mga emails and scenarios kami na iisa lang ang recipient)

Aware naman kami na bawal lumingon, OO Bawal dapat naka tinggin ka lang sa monitor mo simula umpisa ng shift mo hanggang uwian.  (stiff neck malala)

Ang weird lang na ultimo mga Team Lead na nagtatanong lang how to access files etc, ay na iiscreenshot den at nasasabihan na walang ginagawa.

So paano kami mag cocollab ng ideas namin if bawal kami mag usap at lumingon sa isa't isa?

Ito pa, Bawal kami umuwi ng sakto sa oras pag 5:00 pm uwi mo dapat 5:05 ka mag clock out ayaw nila ng honda go kahit tapos mo na ginagawa mo. like bakit? Hindi nyo naman kami binabayaran ng OT.

Tapos ung mga emails na hindi nasasagutan since naka off ung agent dapat daw sinasagutan so ano te? sasagutan nung agent kahit naka day off? kasalanan ba namin na hindi nareresolve ung issues kase mabagal kayo gumawa ng solution, kaya panay balik ung email.

Ang dami ng umalis sa company na ito, mostly ng mga kasama namin awol na kasi hindi na kaya. partida ung increase ko wala pa since ang sabi ng mga tenured depende sa trip ni tokwa.

tapos ito pa, ung leave mo or even SICK LEAVE WITH VALID PROOF LIKE LABS AND DOCTOR'S LETTER, approved man o hindi babawasan ka ng 0.7 sa KPI mo. so ayon kahit mamamatay kana dahil sa sakit mo kailangan mo pumasok HAHAHA.

and Lastly, nagpakabit sila ng intercom/speaker sa buong office kase sasayaw daw HAHAHAH may naiscreenshot last monday, mga hindi sumayaw bakit daw di nagalaw, inangyan.

Nakakatawa lang na nag titiis ako sa gantong setup.

Kailan kaya kami makakaalis dito?",67,70,1.0,Rant 😡,https://www.reddit.com//r/AntiworkPH/comments/1ag8ljx/ayoko_na/,1ag8ljx
2024-02-02 02:24:31,Text-only,"₱3,900 salary increase as a Manager?","Since May 2023 I’m already doing managerial task as the Team’s POC, at sa wakas nakuha ko na yung formal promotion letter ko this week. 

Sobrang na shock ako nung nakuha ko yung letter because I was expecting more. 🥺 Normal ba na ₱3,900 (8% of my current salary) lang yung nagiging increase sa gantong leadership promotion?",15,19,0.91,Advice Needed 🤔,https://www.reddit.com//r/AntiworkPH/comments/1aghrev/3900_salary_increase_as_a_manager/,1aghrev
2024-02-02 13:17:44,Text-only,"Breach of contract, working as a nurse","Today may duty ako sa ospital pero i decided na mag awol na since di na ako okay sa work ko mentally as a nurse. this is my first work and almost 1 year na ako sa ospital na to tapos 2 years ang contract ko. nag paalam na ako sa seniors ko and one of them said

""Sana npagisipan mo yan ng mabuti...si regular k na..Baka ma breach of contract ka... Habulin k ng ***** (hospital name)..""

ayon i need some advice po and talaga bang makakasuhan ako? may bayad kasi breach of contract na 50k nakakahinayang mag bayad and san ko kukunin yon ni hindi nga ako nakaipon sa isang taon na mababa ang sweldo ko 😭

thanks guys🫶🏼",2,4,1.0,Advice Needed 🤔,https://www.reddit.com//r/AntiworkPH/comments/1agw2oa/breach_of_contract_working_as_a_nurse/,1agw2oa
2024-02-02 06:24:14,Text-only,The GHOST in RECRUITERS,"As per my previous post

[https://www.reddit.com/r/AntiworkPH/comments/191ewsf/hr\_recruitment\_ghosters/](https://www.reddit.com/r/AntiworkPH/comments/191ewsf/hr_recruitment_ghosters/)

Additional thoughts lang:

Kahit anong reach out mo talaga, mag-ignore talaga noh?

Kaya I keep tabs on those companies na NR when it comes to follow-up and even add glassdoor review sa recruitment process nila.

Nakakafrustrate talaga. Nawawalan na ako ng pag-asa dito magwork ng maayos. Sobrang daming pinapagawa na recordings/exam/interviews at kung anu-ano tapos mumultuhin ka lang. Ganito na ba kabastos ang recruitment sector?  I have other applications pero lowball naman based on conversation.

Nawawalan na ako ng pag-asa kahit anong effort mo, nababalewala. At kahit anong lawak ng experience mo, mas pipiliin pa rin nila yung pasok sa lower salary expectation.",6,3,1.0,Rant 😡,https://www.reddit.com//r/AntiworkPH/comments/1agnhvx/the_ghost_in_recruiters/,1agnhvx
2024-02-01 21:10:59,Text-only,Toxic Subordinate,"Hello, I (28 F) got promoted a year ago as the unit head and I have 2 subordinates. Yung isang subordinate (33 F), lagi sya nagkakamali sa work, kaya di maiwasan na lagi ko sya na sisingle out. Medyo disrespectful sya lagi after ko ma point out yung mali nya. Nang sisilent treatment sya the whole day tapos padabog mag trabaho. 

Wala naman ako issue dun, okay lang dabugan dabugan nya ako. Deadma lang ako talaga. Ang pinaka issue ko sa kanya eh, one time nag inuman sila na hindi ako kasama. tapos ginawan na nya ako ng kwento. Basically, Siniraan nya ako ng reputation. Ang masama doon, may mga na recruit na sya na kaworkmate ko din.

Pinapalabas nya na bully ako and siya ang victim. When in reality, Siya itong bastos. Sa kitchen kami nag wowork kaya di na bago yung negative environment sa akin. Pero ngayon lang ako nagka workmate na ganito ka toxic.

Please help me. How do you deal with this kind of subordinate?",14,13,0.94,Advice Needed 🤔,https://www.reddit.com//r/AntiworkPH/comments/1aganig/toxic_subordinate/,1aganig
2024-02-01 16:16:05,Unknown,I don't care if you are a small business. Pay your employees are livable wage.,,25,6,0.92,Rant 😡,https://www.reddit.com//r/AntiworkPH/comments/1ag64jf/i_dont_care_if_you_are_a_small_business_pay_your/,1ag64jf
2024-02-01 14:39:50,Text-only,Abusive Business Partner,"Not sure if this is the right sub pero let me just share this experience with my business partner, the reason I pulled out my investment as well.

I'm no biggie in business pero I run multiple (bigasan, food franchises, small carwash, village parking space and Airbnb in surf area up north), yung iba dyan I owned talaga, others are shared businesses. I still work as a fulltime in a digital agency kasi alipin pa rin tayo ng salapi and I've been in the office since 2015 din and okay naman sya.

Since kilala naman ako ng mga colleagues ko about my businesses, this young colleague and hinawakan ko rin sya before, approached me to asked about starting a small business, so I asked ano business and assess kung ano ba knowledge nya sa papasukin nya. He'll be partnered daw by his mom and girlfriend so I thought okay sya. The way he tells me his plans was good so I offered to give him free consultancy and coaching sa business. Then I told him may new business ako na nakuha (refreshment drinks) baka pwede makiplace in tapos hati na lang sa kita. It run smoothly ng mga 5 months na and my sales are good din. Although the main business is slowly progressing, pero ups naman sya. I decided to invest na rin sa negosyo nya, ako nagayos ng inventory system tapos ako naghanap ng mga direct suppliers na mas mura talaga and also pag may mga meeting ako, nagdadala ako ng products namin to offer as free taste or minsan binibenta ko sa clients haha.

Pero 1 thing I notice bakit mabagal ang sales nila before is papalit palit yung empleyado and laging nagsasara kasi wala raw tatao. I asked him about the employees kasi on paper parang well compensated naman, sa viber chats sobrang okay naman sila makipagusap pero sabi nya ang aarte daw kasi nila. So I offered my help and called my batchmate sa school na looking for work, sa carwash ko talaga sya ilalagay pero nakiusap ako na baka pwede dun muna sa sa store na isa, luckily parang 20 mins away lang sya sa location mas malapit sya actually than my carwash. So at first month okay din ang feedback ni batchmate pero hindi sa colleague ko but to his gf and mom. Marunong daw makisama and natuturuan, pero pag si colleague tinatanong ko sa kanya, sabi nya sa akin is he rarely shows up and always may bad mouth about them as employees. I asked my batchmate kung gusto nya lumipat na sa carwash, which he, without any hesitation said, yes.

Right there, alam ko na tama yung tingin ko, may issue si colleague running a business. He got mad at me when I told him ipupullout ko na yung batchmate ko, kasi tao ko naman talaga sya sa carwash, saying mahihirapan ulit sya humanap ng store manager na hindi maarte. I told him ako maghahire ng tao for his convenience. Nakakuha ako ng tao and sanay talaga sya magmanage ng store, pero sabi ko sa kanya ireport nya sakin ang nangyayari sa store. Weeks later she told me medyo di nga maganda yung palakad ng colleague ko, so I decided magsurprise visit, I asked our store manager to inform me pag papunta sya. After all I almost thought na ako na yung nagpapatakbo ng business namin, from the money I brought in, yung clients and bulk orders na pinasok ko as sales and more. Di nga lang ako makapunta sa pwesto regularly sa dami ng lakad ko here in Metro and province.

Last Saturday, I received a message from store manager, pupunta si colleague with his gf and mom. So pumunta rin ako. I arrived 30 mins later after them and dumaan ako sa likod na door para hindi nila kita. Kakapasok ko pa lang ng gate, I heard my colleague voice saying ""*umalis ka sa harap ko, wala kang kwenta!*"" So di muna ako pumasok since rinig ko from the near window mga convo nila. Then I heard him again talking to that employee na ""*Umuwi ka, ang bobo bobo mo, yan na lang trabaho mo e*."" That employee ran to open the door where I was standing outside, pagbukas nya nagulat sya na andun ako. I saw her eyes na teary na so sumenyas ako na wag magingay and wait nya ko kasi papasok ako ng store.

Upon entering, I heard him shouting to his gf na nasa storefront ""*sabihin mo kay \*store manager, bilisan yung audit at baka maghanap si \*ako ng report, atat pa naman lagi yun.*"" like ang usapan naman every Saturday afternoon magpasa siya ng report sa akin. Si Store manager on her break pero my colleague told her to do the task kahit nakabreak since pwede naman daw sya gawin ng nakaupo.

In my mind, the dude is very different compared pag nasa office sya. Okay sya makipagusap and very positive yung character nya. You can see his immaturity pero gets mo kasi bata pa but he's improving naman.

Since nasa loob na ko, nakatalikod sya sakin, I called his attention. He was surprised and asked if bakit di raw ako dumaan sa harap. I told him kanina pa ko dun and naririnig ko sya, and I heard everything he said about our employees to his badmouth against me. He asked me for a management's talk, usap daw kami pati gf nya. I accepted, pero I asked the employees to join the meeting para malaman bakit ganun ang nangyayari. I was shocked when I heard from our employees yung mga words na ""*mga di kasi kayo nagaral kaya wag kayo magfeeling expert.*"" ""*pang sari sari store lang diskarte nyo hindi pang corporate.*"" and ""*Nagmamagaling ka, wala ka namang kwenta*."" these words daw came to my colleagues mouth kapag nagagalit sya.

So kaya pala nagaalisan mga tao namin, kahit ako aalis pag ganyan. I let our employees out na pero I requested to close the store and go home para they can cool down a bit. I talk to my colleague and his partner that I cannot run business with them kung ganyan sya, right there I said, magpupullout ako ng investments and assets ko. Si colleague nagalit, I can pullout daw pero yung drinks ko lang not the money I invested, akala siguro di ko binabasa yung books, sabi ko we gain since I invested so I will take my money and pati ibang gamit dun na galing sa akin. Yung profit, kanya na kung ayaw nya ibigay.

Last Monday, I pulled out yung mga investments ko sa kanila, I talk to my colleagues mom and gf, mas madali kausap yun e, they helped me withdraw my invested money sa bank, did the paperwork tas pina notary namin. The store is close since then, wala nang pumasok na employees namin. Si colleague, di sya nagpakita that time, absent din sa office, until now. Our CEO knows naman kasi sinumbong pa pala ako nun, pero sabi nya, labas sya sa transactions namin kasi di sya part ng business nya, he spoke to me naman, I told my boss na I can work with him professionally sa company but not as business partner.

Earlier I received a separate viber group from our 3 employees, di na raw sila papasok, I asked them if nabayaran ba sila nung last pay, ayaw nila na kunin. I told them ako na magbabayad, ayaw sana nila pero sabi ko pinasok naman nila yun so babayaran ko, right nila yun e. I also told them na I will help them find new jobs na fit sa kanila. Luckily si Store Manager nailakad ko na sa client ko before pa, she will start ata by feb 15. Yung 2 naman, I refer them to my client's na (convenience store company and logistics/courier company). I also send them a sack of rice each and some groceries.

Nakakahiya talaga yung experience and I learned a lot from this. I will always grateful to those employees who worked for me kaya as much as possible I'll give them extended help. At the very least nakalabas kami lahat sa toxic environment na yun.

&#x200B;

&#x200B;",19,1,0.95,Story 🗣️,https://www.reddit.com//r/AntiworkPH/comments/1ag4pyi/abusive_business_partner/,1ag4pyi
2024-02-02 02:14:11,Text-only,RTO during weekends,"Is it bad kung ayaw ko mag RTO during weekends?  kami mismo naman nagbibigay kung kailan mo gusto mag onsite. Tapos humirit shift lead namin na nagjoke na try ko naman mag weekend work. 

The thing is, sa tagal ko na nagwo-work... ngayon lang ako makakapili ng araw kung kailan gusto ko mag onsite and ayaw ko na muna mag onsite during weekend. Mag WFH na lang ako kapag weekends. 

Hindi na lang ako umiik basta naka plot na ung sched namin.",2,5,1.0,Discussions 💭,https://www.reddit.com//r/AntiworkPH/comments/1aghile/rto_during_weekends/,1aghile
2024-02-01 20:30:09,Text-only,How to decline an interview?,"May interview ako ka sa mga 2 office sa iisang araw next week. Problema magkalayo sila kahit nasa Metro Manila ang office nila. Yung isa ay 11 am sa QC at yung isa ay 1:30 pm sa Makati. Iniisip ko na tanggihan ang isa sa kanila dahil impossible na 11 am magstart ang interview. At tsaka matrapik pa, impossible 30 mins makadating sa Makati kung ano ay nagpa interview sa QC.

May nakaranas na ba ng ganito? Tumanggi din pa din kayo? How did you decline the interview politely, if there is any? 

Salamat!",5,7,0.86,Advice Needed 🤔,https://www.reddit.com//r/AntiworkPH/comments/1ag9w0s/how_to_decline_an_interview/,1ag9w0s
2024-02-01 17:15:21,Text-only,Ganto ba talaga?,"Ganto ba talaga mga supervisor ? Napaka micro managing. 
Hindi ka makakauwi hanggat di sya umuwi. 
Lagi nakatingin sa screen ng laptop mo. 
Tho may mga mistake ako since wala pa ako 3 months dito at nasa probi pa ako pero bakit ganon. Ito lang yung napuntahan kong company na ang supervisor eh bawat galaw mo dapat alam nya. Yung ginagawa mo dapat updated ka. Hindi ko alam yung mga past supervisor ko di naman ganto, malaki nga sahod ko pero ganto makakasalamuha ko. Tapos maririnig ko sa iba ganto daw talaga supervisor ko kaya tiisin ko lang daw. Hanggang sa maregular ako, pero parang di ko ata kaya tiisin kung ganto makakasalamuha ko araw-araw.",9,8,1.0,Rant 😡,https://www.reddit.com//r/AntiworkPH/comments/1ag6yay/ganto_ba_talaga/,1ag6yay
2024-02-01 17:18:09,Text-only,O.A. ba ako para magresign?,"I, 22M just recently started working at this restaurant/cafe (they started transitioning to a restaurant since they're widely known as a cafe) this is my first job and i got hired and started training around the third week of november last year. The training was fun since i really enjoyed the people i trained with. A month later i got deployed into one of their restaurant branches, i was a BIT shocked since i applied for a barista position and was deployed as a dining staff right after training. The interviewer once told me that I might have a chance on becoming a dining staff and asked that if it's okay with me, i gladly said yes since i thought it would looked good for my cv lol. As someone who needed money i sucked it up and tried my best to work there. The thing is, my schedule is a mess. It's not given weekly. let's say the schedule will be given today, and my scheduled work can range up to just 2 to 4 days from now and i might be am shift now but pm shift tomorrow (they're fucking up my body clock lol). I also have a hard time anticipating when my OFF will be unless it's a request off 🥹. My seniors there are all used to it since they're already working there for a year or so. What put me to the edge of resigning is that i once worked 7 days straight with two consec days off, And just the other day, i worked for 8 days straight with two consec off. One of my senior even bragged to me that he worked for 12 days straight 🥲 i immediately thought that that's not something to be happy about 😅. Today i'm on my second day off and natatakot ako na baka papagurin nila uli ako for 7-8 days 🥲

Now please tell me if OA ba ako magresign? I know I just worked there for a couple of months and prolly some of ya'll are gonna tell me na normal lang yan sa ""adulting"" and that i just need to ""suck it up"" 🥲 but I just want a constant schedule and a 5-6 days a week of work 🥹

PS. I graduated from a culinary program (i stopped loving my program when I was on my 3rd year of college hehe, i wanted to shift but decided to go through with it since naawa na ako sa parents ko magpaaral sakin) After graduating, nag try ako mag apply for a barista position since feel ko mag e-enjoy parin ako in the F&B industry (di na pala lol) people have been encouraging me to work in the BPO industry since i have basic english naman daw and could easily land a job there since i'm a college grad 🤔",5,7,1.0,Advice Needed 🤔,https://www.reddit.com//r/AntiworkPH/comments/1ag6zqb/oa_ba_ako_para_magresign/,1ag6zqb
2024-02-01 07:02:09,Text-only,"so my ex-ad agency is so disgusting, especially the executive director","EDIT: a lot of people are messaging me to drop the name, para maiwasan. i'll just use emojis. you will get it if you've been looking at creative job openings at jobstreet.

🛸🐑

background: this ad agency located in mother ignacia, QC is so notorious employees couldn't keep up. they would only employ 10-11 people supporting a lot of clients (they're too many i lost count). 6 out of 10 employees decided to leave because:
1. they dump a shit ton of workload on us without giving us a chance to negotiate, kasi we need to keep our ""partners"" happy
2. managers would file insane incident reports on us for not complying to the deadline. 6/10 employees had PIPs at one point because of it.
3. a lot of ICs work beyond working hours without pay (8am-5pm schedule), because according to our contract, OT pay is invalid in a WFH set up. so during covid no one had any OT pays. there was no consideration even when some of my colleagues timed out at 5am, which was seen by all employees.
4. a manager was shocked that his overworked IC was denied regularization because apparently this executive director bitch decided to weigh in evals from other managers without informing him
5. we are not paid properly even though we were promoted. we had one colleague who was promoted from junior to senior IC with only an appraisal of 1-3k
6. in our quarterly evals, we have this ""team engagement"" shit criterion that bear a significant amount of weight. this is based on our engagement during ""fun meetings"" where we only play jackbox despite our workload. they'll give us low scores here kapag hindi kami favorite
7. no consideration to their employees especially if they're trying to reach a deadline. we had this colleague who was sick and had to take a week-long leave. when he came back, ED almost filed an incident report for loss of profit because they had to find a freelance resource to do his work
8. OA and feeling bagets si ED. she would yell in public, fake laugh, and make up stories to try to make us laugh. muntanga lang kala niya cute siya pag ganon siya
9. they have an offensive sense of humor at times. they're very fond of body shaming.
10. we had another colleague who caught covid and eventually recovered without any financial support from the company. when he came back, HR announced that SSS (i forgot the gov agency) can cover expenses for covid recovery. this colleague asked HR and the CEO in front of all of us if he's qualified to get one even though he has already recovered, to which they answered no and fucking laughed at his face saying ""kawawa ka naman""
11. ED would backstab a former employee who worked poorly during his time in the company, and would constantly make him the butt of the joke of every single thing that she thinks was funny. imagine being a fucking joke to a whole company

it's a lot but that's just the tip of the iceberg. 

no one came forward to DOLE, despite a lot of us talking about it. we feared that if we do so, it'll lessen the chance of finding a new job. heck, a lot of us badly needed work that time.

so fast forward, they recruited a lot of people to fill in the vacancies, most of them are fresh graduates or just got out of their first job. they've also fully RTO'd, and they've been posting stories on their company IG account whenever they have a fun thing going on.

ok so ito ang chika. ED's new directive for the company's social media is to show how ""happy"" they are as a ""family"" to spite those who left. a lot of former employees (including me) are still mutuals with that account, that's why she thought of doing it. napaka-immature talaga. she's 52 for god's sake. 

i don't care how they are doing right now in terms of fun, but i unfollowed them because i keep seeing the ED's face i just wanna throw up.

ito pa, she's keeps on making fun of some former employees like what she did to the former-former one. walang pakundangan kung magsalita. she really thinks she's so fucking funny. i may not be one of them but i feel so bad for them.

though to be fair, current employees do not like her at all. they feel the same way we did when we were still employed there (kaya nakasagap din ako ng chika). they're currently making plans and finding a new job before they could submit their resignation.

this ad agency's never gonna be better if they keep being like that. i'm not sure if other companies behave the same way, but if you want to gain loyalty and productivity from your employees, please, see your employees as humans. that's all we ask for.

tl;dr: ED is trying to make us former employees regret leaving the company by posting stories on their company IG of how ""happy"" they are as a ""family"". truth is the company is disgusting as fuck in terms of employee treatment, that's why a lot of us had to leave, as well as the current ones who replaced us.",31,18,0.98,Story 🗣️,https://www.reddit.com//r/AntiworkPH/comments/1afvjgi/so_my_exad_agency_is_so_disgusting_especially_the/,1afvjgi
2024-02-01 14:07:09,Text-only,Bitchy manager,"How to deal with a bithcy manager na walang empathy at lahat nalang ng gawa mo is kinuquestion? Yung effort mo di ma appreciate. Very one sided pa na sa supervisor lang lagi nakikinig.
Mabait sya pero hindi sya maganda as a manager. I know I have pagkukulang pero andami na ring cases na umalis na staff dahil sa kanya. Pano ko ba matitiis to?",7,9,0.82,Rant 😡,https://www.reddit.com//r/AntiworkPH/comments/1ag474v/bitchy_manager/,1ag474v
